{"schema_version":1,"report_kind":"supply_chain_policy","revision_sha":"8932fc1176543eff3fa826de6924e12ec52f3310","event":"default_branch","path":"artifacts","run_key":"e305fcb297094ff2ad09ba9bab1cb93cbc842ac4ca89b9e26b02f0e58af70080","policy_sha256":"9d56df85253ad0e2ca5d8366bcf2ba7f50b61738980dcc163055555f5ac73f0e","created_at":"2026-10-08T00:55:24.006Z","retention_days":30,"toolchain":{"node":"24.19.0","npm":"11.17.0","rust":"candidate-1.98.0"},"checks":[{"check_id":"npm_advisories","authority":"npm-audit","required":true,"scope":["package-lock.json"],"tool":"npm","tool_version":"11.17.0","advisory_data_revision":null,"state":"fail","completion":"complete","rule_id":"npm-advisory","reason_code":null,"reason_params":{},"finding_count":26,"evidence_sha256":null},{"check_id":"npm_licenses","authority":"npm-license-inventory","required":true,"scope":["package-lock.json"],"tool":"npm-license-inventory","tool_version":"1.0.0","advisory_data_revision":null,"state":"pass","completion":"complete","rule_id":"license-continuity-pass","reason_code":null,"reason_params":{},"finding_count":0,"evidence_sha256":null},{"check_id":"npm_sources","authority":"npm-lock-guard","required":true,"scope":["package-lock.json"],"tool":"npm-lock-guard","tool_version":"1.0.0","advisory_data_revision":null,"state":"pass","completion":"complete","rule_id":"npm-lock-valid","reason_code":null,"reason_params":{},"finding_count":0,"evidence_sha256":null},{"check_id":"cargo_policy","authority":"cargo-deny","required":true,"scope":["Cargo.lock","Cargo.toml"],"tool":"cargo-deny","tool_version":"0.20.2","advisory_data_revision":null,"state":"fail","completion":"complete","rule_id":"cargo-policy-finding","reason_code":null,"reason_params":{},"finding_count":1,"evidence_sha256":"8375f312c69b957dcd858a1b0ae04f23c10c4cecd2d7dbab2b0b21d90b3ca93b"},{"check_id":"repository_secrets","authority":"gitleaks","required":true,"scope":[".git"],"tool":"gitleaks","tool_version":"8.30.1","advisory_data_revision":null,"state":"pass","completion":"complete","rule_id":"secret-clean","reason_code":null,"reason_params":{},"finding_count":0,"evidence_sha256":"ed3433af4cba2855bbab6f9dff1fa4fbb307392d4707282a6e578e4843de4625"},{"check_id":"configuration","authority":"trivy","required":true,"scope":[".github/workflows","apps/api/Dockerfile","apps/dashboard/Dockerfile","package-lock.json","Cargo.lock",".supply-chain/exceptions.json"],"tool":"trivy","tool_version":"0.74.0","advisory_data_revision":null,"state":"pass","completion":"complete","rule_id":"configuration-pass","reason_code":null,"reason_params":{},"finding_count":0,"evidence_sha256":"79d40b18ce4415aca40ab0fa56101aaebaae768a4aae70e7809b79b6b0166709"}],"findings":[],"exceptions":[],"subjects":[],"redaction":{"count":0,"kinds":[]},"artifacts":[],"complete":true,"aggregate":"fail"}